[
  {
    "schema": "cwk.canonical_report.v1",
    "source_namespace": "cwork",
    "report_id": "2070000",
    "title": "汇报-0",
    "author": {
      "source_user_id": "u_writer_1",
      "display_name": "张三"
    },
    "created_at": "2026-08-01T10:00:00Z",
    "source_updated_at": "2026-08-01T12:00:00Z",
    "body": "正文-0: NFC 测试 é",
    "normalizer_version": "v1",
    "canonical_sha256": "2f592ab57fde850f488a6432ed2c570cc9dd38ad93840bc03268f349a0885248"
  },
  {
    "schema": "cwk.canonical_report.v1",
    "source_namespace": "cwork",
    "report_id": "2070001",
    "title": "汇报-1",
    "author": {
      "source_user_id": "u_writer_1",
      "display_name": "张三"
    },
    "created_at": "2026-08-01T10:00:00Z",
    "source_updated_at": "2026-08-01T12:00:00Z",
    "body": "正文-1: NFC 测试 é",
    "normalizer_version": "v1",
    "canonical_sha256": "d0fe7b63c428f61d78a95c76eecf2ea047f5d75f0e328d04159d08be7bcc74c7"
  },
  {
    "schema": "cwk.canonical_report.v1",
    "source_namespace": "cwork",
    "report_id": "2070002",
    "title": "汇报-2",
    "author": {
      "source_user_id": "u_writer_1",
      "display_name": "张三"
    },
    "created_at": "2026-08-01T10:00:00Z",
    "source_updated_at": "2026-08-01T12:00:00Z",
    "body": "正文-2: NFC 测试 é",
    "normalizer_version": "v1",
    "canonical_sha256": "f5f090d9f91507eb492be0e561010d213daa641561243205ec8b86cce42d1318"
  },
  {
    "schema": "cwk.canonical_report.v1",
    "source_namespace": "cwork",
    "report_id": "2070003",
    "title": "汇报-3",
    "author": {
      "source_user_id": "u_writer_1",
      "display_name": "张三"
    },
    "created_at": "2026-08-01T10:00:00Z",
    "source_updated_at": "2026-08-01T12:00:00Z",
    "body": "正文-3: NFC 测试 é",
    "normalizer_version": "v1",
    "canonical_sha256": "a21d037bd2f80f4adde9f936cd4357975b69e9952db6194a5e670bdd5a75e335"
  },
  {
    "schema": "cwk.canonical_report.v1",
    "source_namespace": "cwork",
    "report_id": "2070004",
    "title": "汇报-4",
    "author": {
      "source_user_id": "u_writer_1",
      "display_name": "张三"
    },
    "created_at": "2026-08-01T10:00:00Z",
    "source_updated_at": "2026-08-01T12:00:00Z",
    "body": "正文-4: NFC 测试 é",
    "normalizer_version": "v1",
    "canonical_sha256": "354cd80d934b9ad6e561c6acd8b75e23ed151a3adbb11fa8764eaf0c8f84201a"
  },
  {
    "schema": "cwk.canonical_report.v1",
    "source_namespace": "cwork",
    "report_id": "2070005",
    "title": "汇报-5",
    "author": {
      "source_user_id": "u_writer_1",
      "display_name": "张三"
    },
    "created_at": "2026-08-01T10:00:00Z",
    "source_updated_at": "2026-08-01T12:00:00Z",
    "body": "正文-5: NFC 测试 é",
    "normalizer_version": "v1",
    "canonical_sha256": "1a2c46bbde95d403436a463a180ef402ed914fdb79d8b0866f5e1a1566fe149a"
  },
  {
    "schema": "cwk.canonical_report.v1",
    "source_namespace": "cwork",
    "report_id": "2070006",
    "title": "汇报-6",
    "author": {
      "source_user_id": "u_writer_1",
      "display_name": "张三"
    },
    "created_at": "2026-08-01T10:00:00Z",
    "source_updated_at": "2026-08-01T12:00:00Z",
    "body": "正文-6: NFC 测试 é",
    "normalizer_version": "v1",
    "canonical_sha256": "103ec7515ac73ddebe0a29e787ae0007653db973240bba20912fbb408e26808e"
  },
  {
    "schema": "cwk.canonical_report.v1",
    "source_namespace": "cwork",
    "report_id": "2070007",
    "title": "汇报-7",
    "author": {
      "source_user_id": "u_writer_1",
      "display_name": "张三"
    },
    "created_at": "2026-08-01T10:00:00Z",
    "source_updated_at": "2026-08-01T12:00:00Z",
    "body": "正文-7: NFC 测试 é",
    "normalizer_version": "v1",
    "canonical_sha256": "d9f4c35fe62a35b4fdbfdfc9174ac9ff0259dc907b0df2f1a1b471d905089407"
  },
  {
    "schema": "cwk.canonical_report.v1",
    "source_namespace": "cwork",
    "report_id": "2070008",
    "title": "汇报-8",
    "author": {
      "source_user_id": "u_writer_1",
      "display_name": "张三"
    },
    "created_at": "2026-08-01T10:00:00Z",
    "source_updated_at": "2026-08-01T12:00:00Z",
    "body": "正文-8: NFC 测试 é",
    "normalizer_version": "v1",
    "canonical_sha256": "8a789c1dddab6608a0c89e4641b226bd88fa0b6e4b24bb50eb7282e8020cc486"
  },
  {
    "schema": "cwk.canonical_report.v1",
    "source_namespace": "cwork",
    "report_id": "2070009",
    "title": "汇报-9",
    "author": {
      "source_user_id": "u_writer_1",
      "display_name": "张三"
    },
    "created_at": "2026-08-01T10:00:00Z",
    "source_updated_at": "2026-08-01T12:00:00Z",
    "body": "正文-9: NFC 测试 é",
    "normalizer_version": "v1",
    "canonical_sha256": "a201d7f6ef22144a9abb4c9bb998a4ab67f37766885c402db7ca9f7666280801"
  },
  {
    "schema": "cwk.canonical_report.v1",
    "source_namespace": "cwork",
    "report_id": "2070010",
    "title": "汇报-10",
    "author": {
      "source_user_id": "u_writer_1",
      "display_name": "张三"
    },
    "created_at": "2026-08-01T10:00:00Z",
    "source_updated_at": "2026-08-01T12:00:00Z",
    "body": "正文-10: NFC 测试 é",
    "normalizer_version": "v1",
    "canonical_sha256": "b40f9066c724dd0fa82a77c4f00a89b3742f9bf24c2c9cc2d17eef1569941f39"
  },
  {
    "schema": "cwk.canonical_report.v1",
    "source_namespace": "cwork",
    "report_id": "2070011",
    "title": "汇报-11",
    "author": {
      "source_user_id": "u_writer_1",
      "display_name": "张三"
    },
    "created_at": "2026-08-01T10:00:00Z",
    "source_updated_at": "2026-08-01T12:00:00Z",
    "body": "正文-11: NFC 测试 é",
    "normalizer_version": "v1",
    "canonical_sha256": "e2bd5408edb1634457c2035211eb54a6c1388cd4d926c175dad6c9679460f919"
  },
  {
    "schema": "cwk.canonical_report.v1",
    "source_namespace": "cwork",
    "report_id": "2070012",
    "title": "汇报-12",
    "author": {
      "source_user_id": "u_writer_1",
      "display_name": "张三"
    },
    "created_at": "2026-08-01T10:00:00Z",
    "source_updated_at": "2026-08-01T12:00:00Z",
    "body": "正文-12: NFC 测试 é",
    "normalizer_version": "v1",
    "canonical_sha256": "ed117b472f7af71ae9d7d7db52f90beca100bab923956871ea13626c9e3388ef"
  },
  {
    "schema": "cwk.canonical_report.v1",
    "source_namespace": "cwork",
    "report_id": "2070013",
    "title": "汇报-13",
    "author": {
      "source_user_id": "u_writer_1",
      "display_name": "张三"
    },
    "created_at": "2026-08-01T10:00:00Z",
    "source_updated_at": "2026-08-01T12:00:00Z",
    "body": "正文-13: NFC 测试 é",
    "normalizer_version": "v1",
    "canonical_sha256": "b9ce3e7d52421cb8f4df1eb0869e96de666a195033f903ff149a2eb44edb8b51"
  },
  {
    "schema": "cwk.canonical_report.v1",
    "source_namespace": "cwork",
    "report_id": "2070014",
    "title": "汇报-14",
    "author": {
      "source_user_id": "u_writer_1",
      "display_name": "张三"
    },
    "created_at": "2026-08-01T10:00:00Z",
    "source_updated_at": "2026-08-01T12:00:00Z",
    "body": "正文-14: NFC 测试 é",
    "normalizer_version": "v1",
    "canonical_sha256": "e5574fdb7b5dd0c966ba80f4c9a610050ac2dcab937f6ecc0282558e171e74c8"
  },
  {
    "schema": "cwk.canonical_report.v1",
    "source_namespace": "cwork",
    "report_id": "2070015",
    "title": "汇报-15",
    "author": {
      "source_user_id": "u_writer_1",
      "display_name": "张三"
    },
    "created_at": "2026-08-01T10:00:00Z",
    "source_updated_at": "2026-08-01T12:00:00Z",
    "body": "正文-15: NFC 测试 é",
    "normalizer_version": "v1",
    "canonical_sha256": "d5eedca5e5dab01cba204515d5979e75db84a56e2e5fa8b593310310c59074d5"
  },
  {
    "schema": "cwk.canonical_report.v1",
    "source_namespace": "cwork",
    "report_id": "2070016",
    "title": "汇报-16",
    "author": {
      "source_user_id": "u_writer_1",
      "display_name": "张三"
    },
    "created_at": "2026-08-01T10:00:00Z",
    "source_updated_at": "2026-08-01T12:00:00Z",
    "body": "正文-16: NFC 测试 é",
    "normalizer_version": "v1",
    "canonical_sha256": "32e122e2ae637191e3c23fa4a0476ac87fa2492e6991ba483288c591b2aa5fd3"
  },
  {
    "schema": "cwk.canonical_report.v1",
    "source_namespace": "cwork",
    "report_id": "2070017",
    "title": "汇报-17",
    "author": {
      "source_user_id": "u_writer_1",
      "display_name": "张三"
    },
    "created_at": "2026-08-01T10:00:00Z",
    "source_updated_at": "2026-08-01T12:00:00Z",
    "body": "正文-17: NFC 测试 é",
    "normalizer_version": "v1",
    "canonical_sha256": "78b1bfbb4e785266c0e375714aea3997eca020f1378d150fb1e06c235f318bc6"
  },
  {
    "schema": "cwk.canonical_report.v1",
    "source_namespace": "cwork",
    "report_id": "2070018",
    "title": "汇报-18",
    "author": {
      "source_user_id": "u_writer_1",
      "display_name": "张三"
    },
    "created_at": "2026-08-01T10:00:00Z",
    "source_updated_at": "2026-08-01T12:00:00Z",
    "body": "正文-18: NFC 测试 é",
    "normalizer_version": "v1",
    "canonical_sha256": "9e35d241b76b53fe90396b6b1e12fc740e5d0bc86113c11bc416e4b2dc08881e"
  },
  {
    "schema": "cwk.canonical_report.v1",
    "source_namespace": "cwork",
    "report_id": "2070019",
    "title": "汇报-19",
    "author": {
      "source_user_id": "u_writer_1",
      "display_name": "张三"
    },
    "created_at": "2026-08-01T10:00:00Z",
    "source_updated_at": "2026-08-01T12:00:00Z",
    "body": "正文-19: NFC 测试 é",
    "normalizer_version": "v1",
    "canonical_sha256": "58ff12391de8123b0e127e5fbf8744091549c8c04127e48e224fc10a457ecc41"
  },
  {
    "schema": "cwk.canonical_report.v1",
    "source_namespace": "cwork",
    "report_id": "2070020",
    "title": "汇报-20",
    "author": {
      "source_user_id": "u_writer_1",
      "display_name": "张三"
    },
    "created_at": "2026-08-01T10:00:00Z",
    "source_updated_at": "2026-08-01T12:00:00Z",
    "body": "正文-20: NFC 测试 é",
    "normalizer_version": "v1",
    "canonical_sha256": "a82bcf3d772145986263ef89cd7650339c9a35ca34692a6928999420c086b597"
  },
  {
    "schema": "cwk.canonical_report.v1",
    "source_namespace": "cwork",
    "report_id": "2070021",
    "title": "汇报-21",
    "author": {
      "source_user_id": "u_writer_1",
      "display_name": "张三"
    },